{
  "schema_version": "inferdrome.trial-set.v1",
  "trial_set_id": "trial-set-11111111111111111111111111111111",
  "experiment_id": "exp-conformance",
  "title": "Repeated conformance trial",
  "hypothesis": "Repeated runs preserve the configured treatment.",
  "created_at": "2026-08-07T12:00:00Z",
  "design_status": "RETROSPECTIVE",
  "membership_policy": "same_execution_fingerprint_v1",
  "request_population_policy": "separate_per_run_v1",
  "statistical_unit": "run",
  "weighting": "equal_per_run",
  "execution_fingerprint": "sha256:aaaaaaaaaaaaaaaaaaaaaaaaaaaaaaaaaaaaaaaaaaaaaaaaaaaaaaaaaaaaaaaa",
  "metric_definitions_digest": "sha256:bbbbbbbbbbbbbbbbbbbbbbbbbbbbbbbbbbbbbbbbbbbbbbbbbbbbbbbbbbbbbbbb",
  "reducer_version": "1.0.0",
  "members": [
    {
      "repetition_index": 0,
      "run_id": "run-11111111111111111111111111111111",
      "bundle_digest": "sha256:cccccccccccccccccccccccccccccccccccccccccccccccccccccccccccccccc"
    },
    {
      "repetition_index": 1,
      "run_id": "run-22222222222222222222222222222222",
      "bundle_digest": "sha256:dddddddddddddddddddddddddddddddddddddddddddddddddddddddddddddddd"
    }
  ]
}
